{
  "$schema": "http://json-schema.org/draft-04/schema#",
  "additionalProperties": false,
  "properties": {
    "$schema": {
      "type": "string"
    },
    "authentication": {
      "additionalProperties": false,
      "properties": {
        "account": {
          "type": "string"
        },
        "accountOfCurrentUser": {
          "type": "string"
        },
        "alreadyActivated": {
          "type": "string"
        },
        "alreadyLoggedIn": {
          "type": "string"
        },
        "backToLogin": {
          "type": "string"
        },
        "beginCreateFirstUser": {
          "type": "string"
        },
        "changePassword": {
          "type": "string"
        },
        "confirmGeneration": {
          "type": "string"
        },
        "confirmPassword": {
          "type": "string"
        },
        "emailNotValid": {
          "type": "string"
        },
        "emailSent": {
          "type": "string"
        },
        "enableAPIKey": {
          "type": "string"
        },
        "failedToUnlock": {
          "type": "string"
        },
        "forceUnlock": {
          "type": "string"
        },
        "forgotPassword": {
          "type": "string"
        },
        "forgotPasswordEmailInstructions": {
          "type": "string"
        },
        "forgotPasswordQuestion": {
          "type": "string"
        },
        "generate": {
          "type": "string"
        },
        "generateNewAPIKey": {
          "type": "string"
        },
        "logBackIn": {
          "type": "string"
        },
        "loggedOutInactivity": {
          "type": "string"
        },
        "login": {
          "type": "string"
        },
        "logOut": {
          "type": "string"
        },
        "logout": {
          "type": "string"
        },
        "logoutUser": {
          "type": "string"
        },
        "newAPIKeyGenerated": {
          "type": "string"
        },
        "newPassword": {
          "type": "string"
        },
        "resetPassword": {
          "type": "string"
        },
        "stayLoggedIn": {
          "type": "string"
        },
        "successfullyUnlocked": {
          "type": "string"
        },
        "unableToVerify": {
          "type": "string"
        },
        "verified": {
          "type": "string"
        },
        "verifiedSuccessfully": {
          "type": "string"
        },
        "verify": {
          "type": "string"
        },
        "verifyUser": {
          "type": "string"
        },
        "youAreInactive": {
          "type": "string"
        }
      },
      "required": [
        "account",
        "accountOfCurrentUser",
        "alreadyActivated",
        "alreadyLoggedIn",
        "backToLogin",
        "beginCreateFirstUser",
        "changePassword",
        "confirmGeneration",
        "confirmPassword",
        "emailNotValid",
        "emailSent",
        "enableAPIKey",
        "failedToUnlock",
        "forceUnlock",
        "forgotPassword",
        "forgotPasswordEmailInstructions",
        "forgotPasswordQuestion",
        "generate",
        "generateNewAPIKey",
        "logBackIn",
        "loggedOutInactivity",
        "login",
        "logOut",
        "logout",
        "logoutUser",
        "newAPIKeyGenerated",
        "newPassword",
        "resetPassword",
        "stayLoggedIn",
        "successfullyUnlocked",
        "unableToVerify",
        "verified",
        "verifiedSuccessfully",
        "verify",
        "verifyUser",
        "youAreInactive"
      ],
      "type": "object"
    },
    "error": {
      "additionalProperties": false,
      "properties": {
        "autosaving": {
          "type": "string"
        },
        "correctInvalidFields": {
          "type": "string"
        },
        "deletingTitle": {
          "type": "string"
        },
        "loadingDocument": {
          "type": "string"
        },
        "noMatchedField": {
          "type": "string"
        },
        "notAllowedToAccessPage": {
          "type": "string"
        },
        "previewing": {
          "type": "string"
        },
        "unknown": {
          "type": "string"
        }
      },
      "required": [
        "autosaving",
        "correctInvalidFields",
        "deletingTitle",
        "loadingDocument",
        "noMatchedField",
        "notAllowedToAccessPage",
        "previewing",
        "unknown"
      ],
      "type": "object"
    },
    "fields": {
      "additionalProperties": false,
      "properties": {
        "addLabel": {
          "type": "string"
        },
        "addNew": {
          "type": "string"
        },
        "addNewLabel": {
          "type": "string"
        },
        "block": {
          "type": "string"
        },
        "blocks": {
          "type": "string"
        },
        "blockType": {
          "type": "string"
        },
        "chooseFromExisting": {
          "type": "string"
        },
        "collapseAll": {
          "type": "string"
        },
        "itemsAndMore": {
          "type": "string"
        },
        "latitude": {
          "type": "string"
        },
        "longitude": {
          "type": "string"
        },
        "passwordsDoNotMatch": {
          "type": "string"
        },
        "searchForBlock": {
          "type": "string"
        },
        "selectFieldsToEdit": {
          "type": "string"
        },
        "showAll": {
          "type": "string"
        },
        "uploadNewLabel": {
          "type": "string"
        }
      },
      "required": [
        "addLabel",
        "addNew",
        "addNewLabel",
        "block",
        "blocks",
        "blockType",
        "chooseFromExisting",
        "collapseAll",
        "itemsAndMore",
        "latitude",
        "longitude",
        "passwordsDoNotMatch",
        "searchForBlock",
        "selectFieldsToEdit",
        "showAll",
        "uploadNewLabel"
      ],
      "type": "object"
    },
    "general": {
      "additionalProperties": false,
      "properties": {
        "addBelow": {
          "type": "string"
        },
        "addFilter": {
          "type": "string"
        },
        "adminTheme": {
          "type": "string"
        },
        "and": {
          "type": "string"
        },
        "applyChanges": {
          "type": "string"
        },
        "ascending": {
          "type": "string"
        },
        "automatic": {
          "type": "string"
        },
        "backToDashboard": {
          "type": "string"
        },
        "cancel": {
          "type": "string"
        },
        "changesNotSaved": {
          "type": "string"
        },
        "close": {
          "type": "string"
        },
        "collapse": {
          "type": "string"
        },
        "collections": {
          "type": "string"
        },
        "columns": {
          "type": "string"
        },
        "columnToSort": {
          "type": "string"
        },
        "confirm": {
          "type": "string"
        },
        "confirmDeletion": {
          "type": "string"
        },
        "confirmDuplication": {
          "type": "string"
        },
        "copied": {
          "type": "string"
        },
        "copy": {
          "type": "string"
        },
        "create": {
          "type": "string"
        },
        "created": {
          "type": "string"
        },
        "createNew": {
          "type": "string"
        },
        "createNewLabel": {
          "type": "string"
        },
        "creating": {
          "type": "string"
        },
        "creatingNewLabel": {
          "type": "string"
        },
        "dark": {
          "type": "string"
        },
        "dashboard": {
          "type": "string"
        },
        "delete": {
          "type": "string"
        },
        "deleting": {
          "type": "string"
        },
        "descending": {
          "type": "string"
        },
        "deselectAllRows": {
          "type": "string"
        },
        "duplicate": {
          "type": "string"
        },
        "duplicateWithoutSaving": {
          "type": "string"
        },
        "edit": {
          "type": "string"
        },
        "editing": {
          "type": "string"
        },
        "editLabel": {
          "type": "string"
        },
        "email": {
          "type": "string"
        },
        "emailAddress": {
          "type": "string"
        },
        "enterAValue": {
          "type": "string"
        },
        "error": {
          "type": "string"
        },
        "errors": {
          "type": "string"
        },
        "fallbackToDefaultLocale": {
          "type": "string"
        },
        "filters": {
          "type": "string"
        },
        "filterWhere": {
          "type": "string"
        },
        "globals": {
          "type": "string"
        },
        "language": {
          "type": "string"
        },
        "lastModified": {
          "type": "string"
        },
        "leaveAnyway": {
          "type": "string"
        },
        "leaveWithoutSaving": {
          "type": "string"
        },
        "light": {
          "type": "string"
        },
        "livePreview": {
          "type": "string"
        },
        "loading": {
          "type": "string"
        },
        "locale": {
          "type": "string"
        },
        "menu": {
          "type": "string"
        },
        "moveDown": {
          "type": "string"
        },
        "moveUp": {
          "type": "string"
        },
        "noFiltersSet": {
          "type": "string"
        },
        "noLabel": {
          "type": "string"
        },
        "none": {
          "type": "string"
        },
        "noOptions": {
          "type": "string"
        },
        "noResults": {
          "type": "string"
        },
        "nothingFound": {
          "type": "string"
        },
        "noValue": {
          "type": "string"
        },
        "of": {
          "type": "string"
        },
        "open": {
          "type": "string"
        },
        "or": {
          "type": "string"
        },
        "order": {
          "type": "string"
        },
        "pageNotFound": {
          "type": "string"
        },
        "password": {
          "type": "string"
        },
        "payloadSettings": {
          "type": "string"
        },
        "perPage": {
          "type": "string"
        },
        "remove": {
          "type": "string"
        },
        "reset": {
          "type": "string"
        },
        "save": {
          "type": "string"
        },
        "searchBy": {
          "type": "string"
        },
        "selectAll": {
          "type": "string"
        },
        "selectAllRows": {
          "type": "string"
        },
        "selectedCount": {
          "type": "string"
        },
        "selectValue": {
          "type": "string"
        },
        "showAllLabel": {
          "type": "string"
        },
        "sorryNotFound": {
          "type": "string"
        },
        "sort": {
          "type": "string"
        },
        "sortByLabelDirection": {
          "type": "string"
        },
        "stayOnThisPage": {
          "type": "string"
        },
        "submissionSuccessful": {
          "type": "string"
        },
        "submit": {
          "type": "string"
        },
        "successfullyDuplicated": {
          "type": "string"
        },
        "titleDeleted": {
          "type": "string"
        },
        "untitled": {
          "type": "string"
        },
        "updatedAt": {
          "type": "string"
        },
        "updating": {
          "type": "string"
        },
        "welcome": {
          "type": "string"
        }
      },
      "required": [
        "addBelow",
        "addFilter",
        "adminTheme",
        "and",
        "ascending",
        "automatic",
        "backToDashboard",
        "cancel",
        "changesNotSaved",
        "close",
        "collections",
        "columns",
        "columnToSort",
        "confirm",
        "confirmDeletion",
        "confirmDuplication",
        "copied",
        "copy",
        "create",
        "created",
        "createNew",
        "createNewLabel",
        "creating",
        "creatingNewLabel",
        "dark",
        "dashboard",
        "delete",
        "deleting",
        "descending",
        "duplicate",
        "duplicateWithoutSaving",
        "edit",
        "editing",
        "editLabel",
        "email",
        "emailAddress",
        "enterAValue",
        "error",
        "errors",
        "fallbackToDefaultLocale",
        "filters",
        "filterWhere",
        "globals",
        "language",
        "lastModified",
        "leaveAnyway",
        "leaveWithoutSaving",
        "light",
        "loading",
        "moveDown",
        "moveUp",
        "noFiltersSet",
        "noLabel",
        "none",
        "noResults",
        "nothingFound",
        "noValue",
        "of",
        "or",
        "order",
        "pageNotFound",
        "password",
        "payloadSettings",
        "perPage",
        "remove",
        "save",
        "searchBy",
        "selectAll",
        "selectedCount",
        "selectValue",
        "sorryNotFound",
        "sort",
        "stayOnThisPage",
        "submissionSuccessful",
        "submit",
        "successfullyDuplicated",
        "titleDeleted",
        "untitled",
        "updatedAt",
        "updating",
        "welcome"
      ],
      "type": "object"
    },
    "operators": {
      "additionalProperties": false,
      "properties": {
        "contains": {
          "type": "string"
        },
        "equals": {
          "type": "string"
        },
        "exists": {
          "type": "string"
        },
        "isGreaterThan": {
          "type": "string"
        },
        "isGreaterThanOrEqualTo": {
          "type": "string"
        },
        "isIn": {
          "type": "string"
        },
        "isLessThan": {
          "type": "string"
        },
        "isLessThanOrEqualTo": {
          "type": "string"
        },
        "isLike": {
          "type": "string"
        },
        "isNotEqualTo": {
          "type": "string"
        },
        "isNotIn": {
          "type": "string"
        },
        "near": {
          "type": "string"
        }
      },
      "required": [
        "equals",
        "isNotEqualTo",
        "isIn",
        "isNotIn",
        "exists",
        "isGreaterThan",
        "isLessThan",
        "isLessThanOrEqualTo",
        "isGreaterThanOrEqualTo",
        "near",
        "isLike",
        "contains"
      ],
      "type": "object"
    },
    "upload": {
      "additionalProperties": false,
      "properties": {
        "crop": {
          "type": "string"
        },
        "cropToolDescription": {
          "type": "string"
        },
        "dragAndDrop": {
          "type": "string"
        },
        "editImage": {
          "type": "string"
        },
        "focalPoint": {
          "type": "string"
        },
        "focalPointDescription": {
          "type": "string"
        },
        "height": {
          "type": "string"
        },
        "previewSizes": {
          "type": "string"
        },
        "selectCollectionToBrowse": {
          "type": "string"
        },
        "selectFile": {
          "type": "string"
        },
        "setCropArea": {
          "type": "string"
        },
        "setFocalPoint": {
          "type": "string"
        },
        "sizesFor": {
          "type": "string"
        },
        "width": {
          "type": "string"
        }
      },
      "required": [
        "dragAndDrop",
        "height",
        "selectCollectionToBrowse",
        "selectFile",
        "width"
      ],
      "type": "object"
    },
    "validation": {
      "additionalProperties": false,
      "properties": {
        "fieldHasNo": {
          "type": "string"
        },
        "limitReached": {
          "type": "string"
        }
      },
      "required": [
        "fieldHasNo"
      ],
      "type": "object"
    },
    "version": {
      "additionalProperties": false,
      "properties": {
        "aboutToRestore": {
          "type": "string"
        },
        "aboutToRestoreGlobal": {
          "type": "string"
        },
        "compareVersion": {
          "type": "string"
        },
        "confirmUnpublish": {
          "type": "string"
        },
        "confirmVersionRestoration": {
          "type": "string"
        },
        "noFurtherVersionsFound": {
          "type": "string"
        },
        "noRowsFound": {
          "type": "string"
        },
        "preview": {
          "type": "string"
        },
        "problemRestoringVersion": {
          "type": "string"
        },
        "publishChanges": {
          "type": "string"
        },
        "restoreThisVersion": {
          "type": "string"
        },
        "restoring": {
          "type": "string"
        },
        "selectLocales": {
          "type": "string"
        },
        "selectVersionToCompare": {
          "type": "string"
        },
        "showLocales": {
          "type": "string"
        },
        "type": {
          "type": "string"
        },
        "unpublish": {
          "type": "string"
        },
        "unpublishing": {
          "type": "string"
        },
        "versionCreatedOn": {
          "type": "string"
        },
        "versionID": {
          "type": "string"
        },
        "versions": {
          "type": "string"
        },
        "viewingVersion": {
          "type": "string"
        },
        "viewingVersionGlobal": {
          "type": "string"
        },
        "viewingVersions": {
          "type": "string"
        },
        "viewingVersionsGlobal": {
          "type": "string"
        }
      },
      "required": [
        "aboutToRestore",
        "aboutToRestoreGlobal",
        "compareVersion",
        "confirmUnpublish",
        "confirmVersionRestoration",
        "noFurtherVersionsFound",
        "noRowsFound",
        "preview",
        "problemRestoringVersion",
        "publishChanges",
        "restoreThisVersion",
        "restoring",
        "selectLocales",
        "selectVersionToCompare",
        "showLocales",
        "type",
        "unpublish",
        "unpublishing",
        "versionCreatedOn",
        "versionID",
        "versions",
        "viewingVersion",
        "viewingVersionGlobal",
        "viewingVersions",
        "viewingVersionsGlobal"
      ],
      "type": "object"
    }
  },
  "required": [
    "authentication",
    "error",
    "fields",
    "general",
    "upload",
    "validation",
    "version"
  ],
  "type": "object"
}