{
  "$schema": "./translation-schema.json",
  "authentication": {
    "account": "Nalog",
    "accountOfCurrentUser": "Nalog trenutnog korisnika",
    "alreadyActivated": "Već aktivirano",
    "alreadyLoggedIn": "Već prijavljen",
    "backToLogin": "Nazad na prijavu",
    "beginCreateFirstUser": "Na samom početku kreiraj svog prvog korisnika",
    "changePassword": "Promeni lozinku",
    "confirmGeneration": "Potvrdi kreiranje",
    "confirmPassword": "Potvrdi lozinku",
    "emailNotValid": "Adresa e-pošte nije validna",
    "emailSent": "Poruka e-pošte prosleđena",
    "enableAPIKey": "Omogući API ključ",
    "failedToUnlock": "Neuspešno otključavanje.",
    "forceUnlock": "Prinudno otključaj",
    "forgotPassword": "Zaboravljena lozinka",
    "forgotPasswordEmailInstructions": "Molimo Vas da unesete svoj adresu e-pošte. Primićete poruku sa uputstvom za ponovno postavljanje lozinke.",
    "forgotPasswordQuestion": "Zaboravljena lozinka?",
    "generate": "Generiši",
    "generateNewAPIKey": "Generiši novi API ključ",
    "logBackIn": "Ponovna prijava",
    "logOut": "Odjava",
    "loggedOutInactivity": "Odjavljeni se zbog neaktivnosti.",
    "login": "Prijava",
    "logout": "Odjava",
    "logoutUser": "Odjava korisnika",
    "newAPIKeyGenerated": "Novi API ključ generisan.",
    "newPassword": "Nova lozinka",
    "resetPassword": "Promena lozinke",
    "stayLoggedIn": "Ostani prijavljen",
    "successfullyUnlocked": "Uspešno otključano",
    "unableToVerify": "Nije moguće potvrditi",
    "verified": "Potvrđeno",
    "verifiedSuccessfully": "Uspešno potvrđeno",
    "verify": "Potvrdi",
    "verifyUser": "Potvrdi korisnika",
    "youAreInactive": "Neaktivni ste već neko vreme i uskoro ćete biti automatski odjavljeni zbog sigurnosti. Da li želite ostati prijavljeni?"
  },
  "error": {
    "autosaving": "Nastao je problem pri automatskom čuvanju ovog dokumenta.",
    "correctInvalidFields": "Molimo ispravite nevalidna polja.",
    "deletingTitle": "Dogodila se greška pri brisanju {{title}}. Proverite internet konekciju i pokušajte ponovo.",
    "loadingDocument": "Postoji problem pri učitavanju dokumenta čiji je ID {{id}}.",
    "noMatchedField": "Nema podudarajućih polja za \"{{label}}\"",
    "notAllowedToAccessPage": "Nemate dozvolu za pristup ovoj stranici.",
    "previewing": "Postoji problem pri pregledu ovog dokumenta.",
    "unknown": "Došlo je do nepoznate greške."
  },
  "fields": {
    "addLabel": "Dodaj {{label}}",
    "addNew": "Dodaj novi",
    "addNewLabel": "Dodaj novi {{label}}",
    "block": "blokiranje",
    "blockType": "Vrsta blokiranja",
    "blocks": "blokiranja",
    "chooseFromExisting": "Odaberite iz postojećih.",
    "collapseAll": "Skupi sve",
    "itemsAndMore": "{{items}} i {{count}} više",
    "latitude": "Geografska širina",
    "longitude": "Geografska dužina",
    "passwordsDoNotMatch": "Lozinke nisu iste.",
    "searchForBlock": "Pretraži blok",
    "selectFieldsToEdit": "Odaberite polja za promenu",
    "showAll": "Pokaži sve",
    "uploadNewLabel": "Učitaj novi {{label}}"
  },
  "general": {
    "addBelow": "Dodaj ispod",
    "addFilter": "Dodaj filter",
    "adminTheme": "Administratorska tema",
    "and": "I",
    "applyChanges": "Primeni promene",
    "ascending": "Uzlazno",
    "automatic": "Automatsko",
    "backToDashboard": "Nazad na kontrolni panel",
    "cancel": "Otkaži",
    "changesNotSaved": "Vaše promene nisu sačuvane. Ako izađete sada, izgubićete promene.",
    "close": "Zatvori",
    "collapse": "Skupi",
    "collections": "Kolekcije",
    "columnToSort": "Kolona za sortiranje",
    "columns": "Kolone",
    "confirm": "Potvrdi",
    "confirmDeletion": "Potvrdi brisanje",
    "confirmDuplication": "Potvrdi duplikaciju",
    "copied": "Kopirano",
    "copy": "Kopiraj",
    "create": "Kreiraj",
    "createNew": "Kreiraj novo",
    "createNewLabel": "Kreiraj novo {{label}}",
    "created": "Kreirano",
    "creating": "Kreira se",
    "creatingNewLabel": "Kreiranje novog {{label}}",
    "dark": "Tamno",
    "dashboard": "Kontrolni panel",
    "delete": "Obriši",
    "deleting": "Brisanje...",
    "descending": "Opadajuće",
    "deselectAllRows": "Deselektujte sve redove",
    "duplicate": "Duplikat",
    "duplicateWithoutSaving": "Ponovi bez čuvanja promena",
    "edit": "Uredi",
    "editLabel": "Uredi {{label}}",
    "editing": "Uređivanje",
    "email": "E-pošta",
    "emailAddress": "Аdresa e-pošte",
    "enterAValue": "Unesi vrednost",
    "error": "Greška",
    "errors": "Greške",
    "fallbackToDefaultLocale": "Vraćanje na zadati jezik",
    "filterWhere": "Filter {{label}} gde",
    "filters": "Filteri",
    "globals": "Globali",
    "language": "Jezik",
    "lastModified": "Zadnja promena",
    "leaveAnyway": "Svejedno napusti",
    "leaveWithoutSaving": "Napusti bez čuvanja",
    "light": "Svetlo",
    "livePreview": "Pregled",
    "loading": "Učitavanje",
    "locale": "Jezik",
    "menu": "Meni",
    "moveDown": "Pomeri dole",
    "moveUp": "Pomeri gore",
    "noFiltersSet": "Nema postavljenih filtera",
    "noLabel": "<Nema {{label}}>",
    "noOptions": "Nema opcija",
    "noResults": "Nema pronađenih {{label}}. Moguće da {{label}} još uvek ne postoji ili nema rezultata u skladu sa postavljenim filterima.",
    "noValue": "Bez vrednosti",
    "none": "Nijedan",
    "nothingFound": "Ništa nije pronađeno",
    "of": "Od",
    "open": "Otvori",
    "or": "Ili",
    "order": "Redosled",
    "pageNotFound": "Stranica nije pronađena",
    "password": "Lozinka",
    "payloadSettings": "Payload postavke",
    "perPage": "Po stranici: {{limit}}",
    "remove": "Ukloni",
    "reset": "Ponovo postavi",
    "save": "Sačuvaj",
    "searchBy": "Traži po {{label}}",
    "selectAll": "Odaberite sve {{count}} {{label}}",
    "selectAllRows": "Odaberite sve redove",
    "selectValue": "Odaberi vrednost",
    "selectedCount": "{{count}} {{label}} odabrano",
    "showAllLabel": "Prikaži sve {{label}}",
    "sorryNotFound": "Nažalost, ne postoji ništa što odgovara vašem zahtevu.",
    "sort": "Sortiraj",
    "sortByLabelDirection": "Sortiraj prema {{label}} {{direction}}",
    "stayOnThisPage": "Ostani na ovoj stranici",
    "submissionSuccessful": "Uspešno slanje",
    "submit": "Potvrdi",
    "successfullyDuplicated": "{{label}} uspešno duplicirano.",
    "titleDeleted": "{{label}} \"{{title}}\" uspešno obrisano.",
    "untitled": "Bez naslova",
    "updatedAt": "Ažurirano u",
    "updating": "Ažuriranje",
    "welcome": "Dobrodošli"
  },
  "upload": {
    "crop": "Isecite sliku",
    "cropToolDescription": "Prevucite uglove izabranog područja, nacrtajte novo područje ili prilagodite vrednosti ispod.",
    "dragAndDrop": "Prevucite i ispustite datoteku",
    "editImage": "Uredi sliku",
    "focalPoint": "Centralna tačka",
    "focalPointDescription": "Prevucite središnju tačku direktno na pregled ili prilagodite vrednosti ispod.",
    "height": "Visina",
    "previewSizes": "Veličine pregleda",
    "selectCollectionToBrowse": "Odaberite kolekciju za pregled",
    "selectFile": "Odaberite datoteku",
    "setCropArea": "Postavite područje za isečenu sliku",
    "setFocalPoint": "Postavite centralnu tačku",
    "sizesFor": "Veličine za {{label}}",
    "width": "Širina"
  },
  "validation": {
    "fieldHasNo": "Ovo polje nema {{label}}",
    "limitReached": "Dosegnut je limit, može se dodati samo {{max}} stavki."
  },
  "version": {
    "aboutToRestore": "Vratićete {{label}} dokument u stanje u kojem je bio {{versionDate}}",
    "aboutToRestoreGlobal": "Vratićete globalni {{label}} u stanje u kojem je bio {{versionDate}}.",
    "compareVersion": "Uporedi verziju sa:",
    "confirmUnpublish": "Potvrdite poništavanje objave",
    "confirmVersionRestoration": "Potvrdite vraćanje verzije",
    "noFurtherVersionsFound": "Nisu pronađene naredne verzije",
    "noRowsFound": "{{label}} nije pronađeno",
    "preview": "Pregled",
    "problemRestoringVersion": "Nastao je problem pri vraćanju ove verzije",
    "publishChanges": "Objavi promene",
    "restoreThisVersion": "Vrati ovu verziju",
    "restoring": "Vraćanje...",
    "selectLocales": "Odaberite jezike",
    "selectVersionToCompare": "Odaberite verziju za upoređivanje",
    "showLocales": "Prikaži jezike:",
    "type": "Tip",
    "unpublish": "Poništi objavu",
    "unpublishing": "Poništavanje objave...",
    "versionCreatedOn": "{{version}} kreiranih:",
    "versionID": "ID verzije",
    "versions": "Verzije",
    "viewingVersion": "Pregled verzije za {{entityLabel}} {{documentTitle}}",
    "viewingVersionGlobal": "Pregled verzije za globalni {{entityLabel}}",
    "viewingVersions": "Pregled verzija za {{entityLabel}} {{documentTitle}}",
    "viewingVersionsGlobal": "Pregled verzije za globalni {{entityLabel}}"
  }
}