{
  "$schema": "./translation-schema.json",
  "authentication": {
    "account": "Account",
    "accountOfCurrentUser": "Account dell'utente corrente",
    "alreadyActivated": "Già Attivato",
    "alreadyLoggedIn": "Sei già loggato",
    "backToLogin": "Torna al login",
    "beginCreateFirstUser": "Per iniziare, crea il tuo primo utente.",
    "changePassword": "Cambia Password",
    "confirmGeneration": "Conferma Generazione",
    "confirmPassword": "Conferma Password",
    "emailNotValid": "L'email fornita non è valida",
    "emailSent": "Email Inviata",
    "enableAPIKey": "Abilita la Chiave API",
    "failedToUnlock": "Lo sblocco è fallito",
    "forceUnlock": "Forza Sblocco",
    "forgotPassword": "Cambia Password",
    "forgotPasswordEmailInstructions": "Inserisci la tua mail qui sotto. Riceverai un messaggio email con le istruzioni su come cambiare la tua password.",
    "forgotPasswordQuestion": "Password dimenticata?",
    "generate": "Genera",
    "generateNewAPIKey": "Genera una nuova Chiave API",
    "logBackIn": "Vai al Log in",
    "logOut": "Log out",
    "loggedOutInactivity": "Sei stato disconnesso automaticamente per inattività.",
    "login": "Login",
    "logout": "Logout",
    "logoutUser": "Logout utente",
    "newAPIKeyGenerated": "Nuova Chiave API Generata.",
    "newPassword": "Nuova Password",
    "resetPassword": "Modifica Password",
    "stayLoggedIn": "Rimani connesso",
    "successfullyUnlocked": "Sbloccato con successo",
    "unableToVerify": "Impossibile verificare",
    "verified": "Verificato",
    "verifiedSuccessfully": "Verificato con successo",
    "verify": "Verifica",
    "verifyUser": "Verifica Utente",
    "youAreInactive": "Non sei attivo da un po' di tempo e a breve verrai disconnesso automaticamente per la tua sicurezza. Vuoi rimanere connesso?"
  },
  "error": {
    "autosaving": "Si è verificato un problema durante il salvataggio automatico di questo documento.",
    "correctInvalidFields": "Per favore correggi i campi non validi.",
    "deletingTitle": "Si è verificato un errore durante l'eliminazione di {{title}}. Per favore controlla la tua connessione e riprova.",
    "loadingDocument": "Si è verificato un problema durante il caricamento del documento con ID {{id}}.",
    "noMatchedField": "Nessun campo corrispondente trovato per \"{{label}}\"",
    "notAllowedToAccessPage": "Non sei autorizzato ad accedere a questa pagina.",
    "previewing": "Si è verificato un problema durante l'anteprima di questo documento.",
    "unknown": "Si è verificato un errore sconosciuto."
  },
  "fields": {
    "addLabel": "Aggiungi {{label}}",
    "addNew": "Aggiungi nuovo",
    "addNewLabel": "Aggiungi nuovo {{label}}",
    "block": "blocco",
    "blockType": "Tipo di Blocco",
    "blocks": "blocchi",
    "chooseFromExisting": "Scegli tra esistente",
    "collapseAll": "Comprimi tutto",
    "itemsAndMore": "{{items}} e altri {{count}}",
    "latitude": "Latitudine",
    "longitude": "Longitudine",
    "passwordsDoNotMatch": "Le password non corrispondono.",
    "searchForBlock": "Cerca un blocco",
    "selectFieldsToEdit": "Seleziona i campi da modificare",
    "showAll": "Mostra tutto",
    "uploadNewLabel": "Carica nuovo {{label}}"
  },
  "general": {
    "addBelow": "Aggiungi sotto",
    "addFilter": "Aggiungi Filtro",
    "adminTheme": "Tema Admin",
    "and": "E",
    "applyChanges": "Applica modifiche",
    "ascending": "Ascendente",
    "automatic": "Automatico",
    "backToDashboard": "Torna alla Dashboard",
    "cancel": "Cancella",
    "changesNotSaved": "Le tue modifiche non sono state salvate. Se esci ora, verranno perse.",
    "close": "Chiudere",
    "collapse": "Comprimi",
    "collections": "Collezioni",
    "columnToSort": "Colonna da Ordinare",
    "columns": "Colonne",
    "confirm": "Conferma",
    "confirmDeletion": "Conferma l'eliminazione",
    "confirmDuplication": "Conferma la duplicazione",
    "copied": "Copiato",
    "copy": "Copia",
    "create": "Crea",
    "createNew": "Crea Nuovo",
    "createNewLabel": "Crea nuovo {{label}}",
    "created": "Data di creazione",
    "creating": "Crea nuovo",
    "creatingNewLabel": "Creazione di un nuovo {{label}}",
    "dark": "Scuro",
    "dashboard": "Dashboard",
    "delete": "Elimina",
    "deleting": "Sto eliminando...",
    "descending": "Decrescente",
    "deselectAllRows": "Deseleziona tutte le righe",
    "duplicate": "Duplica",
    "duplicateWithoutSaving": "Duplica senza salvare le modifiche",
    "edit": "Modificare",
    "editLabel": "Modifica {{label}}",
    "editing": "Modifica",
    "email": "Email",
    "emailAddress": "Indirizzo Email",
    "enterAValue": "Inserisci un valore",
    "error": "Errore",
    "errors": "Errori",
    "fallbackToDefaultLocale": "Fallback al locale predefinito",
    "filterWhere": "Filtra {{label}} se",
    "filters": "Filtri",
    "globals": "Globali",
    "language": "Lingua",
    "lastModified": "Ultima modifica",
    "leaveAnyway": "Esci comunque",
    "leaveWithoutSaving": "Esci senza salvare",
    "light": "Chiaro",
    "livePreview": "Anteprima dal vivo",
    "loading": "Caricamento",
    "locale": "Locale",
    "menu": "Menù",
    "moveDown": "Sposta sotto",
    "moveUp": "Sposta sopra",
    "noFiltersSet": "Nessun filtro impostato",
    "noLabel": "<No {{label}}>",
    "noOptions": "Nessuna opzione",
    "noResults": "Nessun {{label}} trovato. Non esiste ancora nessun {{label}} oppure nessuno corrisponde ai filtri che hai specificato sopra.",
    "noValue": "Nessun valore",
    "none": "Nessuno",
    "nothingFound": "Non è stato trovato nulla",
    "of": "di",
    "open": "Apri",
    "or": "Oppure",
    "order": "Ordine",
    "pageNotFound": "Pagina non trovata",
    "password": "Password",
    "payloadSettings": "Impostazioni di Payload",
    "perPage": "Per Pagina: {{limit}}",
    "remove": "Rimuovi",
    "reset": "Ripristina",
    "save": "Salva",
    "searchBy": "Cerca per {{label}}",
    "selectAll": "Seleziona tutto {{count}} {{label}}",
    "selectAllRows": "Seleziona tutte le righe",
    "selectValue": "Seleziona un valore",
    "selectedCount": "{{count}} {{label}} selezionato",
    "showAllLabel": "Mostra tutti {{label}}",
    "sorryNotFound": "Siamo spiacenti, non c'è nulla che corrisponda alla tua richiesta.",
    "sort": "Ordina",
    "sortByLabelDirection": "Ordina per {{label}} {{direction}}",
    "stayOnThisPage": "Rimani su questa pagina",
    "submissionSuccessful": "Invio riuscito.",
    "submit": "Invia",
    "successfullyDuplicated": "{{label}} duplicato con successo.",
    "titleDeleted": "{{label}} {{title}} eliminato con successo.",
    "untitled": "Senza titolo",
    "updatedAt": "Aggiornato il",
    "updating": "Aggiornamento",
    "welcome": "Benvenuto"
  },
  "upload": {
    "crop": "Raccolto",
    "cropToolDescription": "Trascina gli angoli dell'area selezionata, disegna una nuova area o regola i valori qui sotto.",
    "dragAndDrop": "Trascina e rilascia un file",
    "editImage": "Modifica immagine",
    "focalPoint": "Punto Focale",
    "focalPointDescription": "Trascina il punto focale direttamente sull'anteprima o regola i valori sottostanti.",
    "height": "Altezza",
    "previewSizes": "Anteprime Dimensioni",
    "selectCollectionToBrowse": "Seleziona una Collezione da Sfogliare",
    "selectFile": "Seleziona un file",
    "setCropArea": "Imposta area di ritaglio",
    "setFocalPoint": "Imposta punto focale",
    "sizesFor": "Dimensioni per {{label}}",
    "width": "Larghezza"
  },
  "validation": {
    "fieldHasNo": "Questo campo non ha {{label}}",
    "limitReached": "Raggiunto il limite, possono essere aggiunti solo {{max}} elementi."
  },
  "version": {
    "aboutToRestore": "Stai per ripristinare questo documento {{label}} allo stato in cui si trovava il {{versionDate}}.",
    "aboutToRestoreGlobal": "Stai per ripristinare {{label}} allo stato in cui si trovava il {{versionDate}}.",
    "compareVersion": "Confronta versione con:",
    "confirmUnpublish": "Conferma annullamento della pubblicazione",
    "confirmVersionRestoration": "Conferma il ripristino della versione",
    "noFurtherVersionsFound": "Non sono state trovate ulteriori versioni",
    "noRowsFound": "Nessun {{label}} trovato",
    "preview": "Anteprima",
    "problemRestoringVersion": "Si è verificato un problema durante il ripristino di questa versione",
    "publishChanges": "Pubblica modifiche",
    "restoreThisVersion": "Ripristina questa versione",
    "restoring": "Ripristino...",
    "selectLocales": "Seleziona le lingue da visualizzare",
    "selectVersionToCompare": "Seleziona una versione da confrontare",
    "showLocales": "Mostra localizzazioni:",
    "type": "Tipo",
    "unpublish": "Annulla pubblicazione",
    "unpublishing": "Annullamento pubblicazione...",
    "versionCreatedOn": "{{version}} creata il:",
    "versionID": "ID Versione",
    "versions": "Versioni",
    "viewingVersion": "Visualizzazione della versione per {{entityLabel}} {{documentTitle}}",
    "viewingVersionGlobal": "`Visualizzazione della versione per {{entityLabel}}",
    "viewingVersions": "Visualizzazione delle versioni per {{entityLabel}} {{documentTitle}}",
    "viewingVersionsGlobal": "`Visualizzazione delle versioni per {{entityLabel}}"
  }
}